<?xml version="1.0"?>
<!DOCTYPE component SYSTEM "componentinfo.dtd">

<component id="starconf" buildsupport="yes">
  <description>Starlink autoconf support</description>
  <path>buildsupport/starconf</path>
  <dependencies>
    <build>automake</build>
  </dependencies>
  <developers>
    <person>
      <name>Norman Gray</name>
      <uname>nxg</uname>
      <email>norman@astro.gla.ac.uk</email>
    </person>
  </developers>
</component>

