<?xml version="1.0"?>
<!DOCTYPE component SYSTEM "componentinfo.dtd">
<!-- component.xml.  Generated from component.xml.in by configure. -->

<component id="figaro" support="S">
  <version>5.6-6</version>
  <path>applications/figaro</path>
  <description>FIGARO general data-reduction system</description>
  <abstract><p>
    Figaro is a general-purpose data reduction package. The programs
    it contains can be used to process a wide range of images and
    spectra.  It is amalgam of traditional Figaro and previously
    separate packages TWODSPEC and SPECDRE.  It does not use Starlink's
    AST infrastructure for world co-ordinate systems.
  </p></abstract>
  <dependencies >
    <build>pcs</build><build option='link'>pda</build><build option='link'>agi</build><build option='link'>grp</build><build option='link'>ndf</build><build option='link'>fio</build><build option='link'>idi</build><build option='link'>shl</build><build option='link'>sla</build><build option='link'>psx</build><sourceset>star2html</sourceset>
  </dependencies>
  <developers>
    <person>
      <name>Keith Shortridge</name>
    </person>
    <person>
      <name>Horst Meyerdierks</name>
    </person>
    <person>
      <name>Martin Clayton</name>
    </person>
    <person>
      <name>Jon Lockley</name>
    </person>
    <person>
      <name>Anne Charles</name>
    </person>
    <person>
      <name>Clive Davenhall</name>
    </person>
    <person>
      <name>Malcolm J Currie</name>
      <uname>mjc</uname>
      <email>mjc@star.rl.ac.uk</email>
      <role>owner</role>
    </person>
    <person>
      <name>Mark Taylor</name>
    </person>
    <person>
      <name>Tim Ash</name>
    </person>
    <person>
      <name>Tim Wilkins</name>
    </person>
    <person>
      <name>Dave Axon</name>
    </person>
    <person>
      <name>John Palmer</name>
    </person>
    <person>
      <name>Anthony Holloway</name>
    </person>
    <person>
      <name>Vito Graffagnino</name>
    </person>
  </developers>
  <documentation> sun86</documentation>
  <bugreports>starlink@jiscmail.ac.uk</bugreports>
  <!-- <notes><p></p></notes> -->
</component>
