<?xml version="1.0"?>
<!DOCTYPE component SYSTEM "componentinfo.dtd">
<!-- component.xml.  Generated from component.xml.in by configure. -->

<component id="hdspar">
  <version>1.0-1</version>
  <path>libraries/pcs/hdspar</path>
  <description>Part of the HDS system.  HDSPAR declares bulk data
    parameters.</description>
  <dependencies>
    <build> sae</build>
    <use> subpar</use>
  </dependencies>
  <developers>
    <person>
      <name>B D Kelly, ROE</name>
    </person>
    <person>
      <name>Alan J Chipperfield</name>
      <uname>ajc</uname>
      <email>a.j.chipperfield@ral.ac.uk</email>
    </person>
  </developers>
  <bugreports>ussc@star.rl.ac.uk</bugreports>
  <notes><p>Documented in SUN/224, handled in pcs directory</p></notes>
</component>
