<?xml version="1.0"?>
<!DOCTYPE component SYSTEM "componentinfo.dtd">
<!-- component.xml.  Generated from component.xml.in by configure. -->

<component id="chart" status="obsolete">
  <version>4.0-1</version>
  <path>applications/obsolete/chart</path>
  <description>CHART - Finding chart and stellar data system</description>
  <abstract><p>
The CHART package extracts positions, magnitudes and other data from
certain stellar and non-stellar astronomical catalogues.  The results
may be listed on a terminal or printer, or used to plot finding charts
or perform astrometric reductions.
  </p></abstract>
  <dependencies >
    <build>pcs</build><build option='link'>chr</build><build option='link'>mers</build><build option='link'>sgs</build><build option='link'>gks</build><build option='link'>ifd</build><build option='link'>graphpar</build><build option='link'>pda</build><sourceset>star2html</sourceset>
  </dependencies>
  <developers>
    <person>
      <name>P M Allan</name>
      <uname>pma</uname>
    </person>
    <person>
      <name>Ken Hartley</name>
    </person>
    <person>
      <name>Joe Vickerstaff</name>
    </person>
    <person>
      <name>Tim Wilkins</name>
    </person>
    <person>
      <name>J V Carey</name>
    </person>
    <person>
      <name>Malcolm Currie</name>
    </person>
  </developers>
  <documentation> sun32</documentation>
  <bugreports>ussc@star.rl.ac.uk</bugreports>
  <!-- <notes><p></p></notes> -->
</component>
