<?xml version="1.0"?>
<!DOCTYPE component SYSTEM "componentinfo.dtd">
<!-- component.xml.  Generated from component.xml.in by configure. -->

<component id="sock">
  <version>1.0</version>
  <path>libraries/pcs/sock</path>
  <description>Provides a Unix-socket-based message transport system
    for the MSP system</description>
  <dependencies>
    <build> sae messgen</build>
    <use></use>
  </dependencies>
  <developers>
    <person>
      <name>B D Kelly</name>
    </person>
  </developers>
  <bugreports>ussc@star.rl.ac.uk</bugreports>
  <notes><p>Described in SSN/29</p></notes>
</component>
