<?xml version="1.0"?>
<!DOCTYPE component SYSTEM "componentinfo.dtd">
<!-- component.xml.  Generated from component.xml.in by configure. -->

<component id="adamnet" status="obsolete">
  <version>1.0</version>
  <path>libraries/pcs/adamnet</path>
  <description>Implements the ADAM networking process. It interfaces
  the ADAM intertask communication software on unix to TCP/IP, thereby
  allowing ADAM tasks on different machines to communicate with one
  another. </description>
  <dependencies >
    <build>sae</build><build>messys</build><build>adam</build><build>ams</build><build>msp</build><build>sock</build><sourceset>messgen</sourceset>
  </dependencies>
  <developers>
    <person>
      <name>B.D.Kelly (REVAD::BDK)</name>
    </person>
    <person>
      <name>Brian K McIlwrath</name>
      <uname>bkm</uname>
      <email>b.k.mcilwrath@rl.ac.uk</email>
    </person>
  </developers>
  <bugreports>ussc@star.rl.ac.uk</bugreports>
</component>
